{
  "version": "1",
  "description": "Authoritative registry of every agent in the AI Engineering OS. scripts/validate_plugin.py enforces that agents/*.md and this file agree on name, tool profile and model, and that every agent has an owner, risk class and evaluation suite.",
  "lifecycle_states": [
    "draft",
    "development",
    "evaluation",
    "security-review",
    "pilot",
    "approved",
    "production",
    "deprecated"
  ],
  "agents": [
    {
      "name": "engineering-director",
      "department": "governance",
      "purpose": "Owns end-to-end delivery of a change: sequences SDLC stages, forms teams, arbitrates cross-department conflict, and escalates decisions that need a human.",
      "tool_profile": "lead",
      "default_model": "opus",
      "escalation_model": "opus",
      "risk": "HIGH",
      "owner": "ai-platform-team",
      "version": "0.2.0",
      "status": "pilot",
      "review_frequency": "quarterly",
      "evaluation_suite": "governance-evaluation",
      "may_spawn": [
        "product-manager",
        "requirements-analyst",
        "solution-architect",
        "architecture-reviewer",
        "ux-designer",
        "development-lead",
        "qa-lead",
        "security-architect",
        "devops-engineer",
        "release-manager",
        "sre",
        "incident-commander",
        "docs-writer"
      ],
      "requires_human_approval_for": [
        "scope change beyond approved requirements",
        "technology selection",
        "release to production"
      ],
      "notes": ""
    },
    {
      "name": "ai-governance",
      "department": "ai-governance",
      "purpose": "Independent authority over the AI Engineering OS itself: agent lifecycle, risk classification, permission and model policy, evaluation standards.",
      "tool_profile": "review-readonly",
      "default_model": "opus",
      "escalation_model": "opus",
      "risk": "CRITICAL",
      "owner": "ai-governance-council",
      "version": "0.1.0",
      "status": "pilot",
      "review_frequency": "monthly",
      "evaluation_suite": "ai-governance-evaluation",
      "may_spawn": [],
      "requires_human_approval_for": [
        "promotion of an agent to production",
        "change to a CRITICAL agent or security hook",
        "permission or model policy change"
      ],
      "notes": "Never writes. Governance decisions are recorded by humans in MRs, not by the agent."
    },
    {
      "name": "product-manager",
      "department": "product",
      "purpose": "Turns business intent into a prioritised, testable product definition and owns the PRD and its acceptance criteria.",
      "tool_profile": "delegating-author",
      "default_model": "sonnet",
      "escalation_model": "opus",
      "risk": "MEDIUM",
      "owner": "product-chapter",
      "version": "0.1.0",
      "status": "pilot",
      "review_frequency": "quarterly",
      "evaluation_suite": "product-evaluation",
      "may_spawn": [
        "requirements-analyst",
        "ux-designer"
      ],
      "requires_human_approval_for": [
        "committing to a business objective the requester did not state"
      ],
      "notes": ""
    },
    {
      "name": "requirements-analyst",
      "department": "product",
      "purpose": "Elicits, disambiguates and records functional and non-functional requirements with full traceability identifiers.",
      "tool_profile": "author",
      "default_model": "sonnet",
      "escalation_model": "opus",
      "risk": "MEDIUM",
      "owner": "product-chapter",
      "version": "0.1.0",
      "status": "pilot",
      "review_frequency": "quarterly",
      "evaluation_suite": "requirements-evaluation",
      "may_spawn": [],
      "requires_human_approval_for": [
        "inventing a requirement that was not stated or confirmed"
      ],
      "notes": ""
    },
    {
      "name": "solution-architect",
      "department": "architecture",
      "purpose": "Produces feasibility assessments, HLD/LLD, contracts, data and deployment models, and ADRs for an approved requirement set.",
      "tool_profile": "author",
      "default_model": "opus",
      "escalation_model": "opus",
      "risk": "HIGH",
      "owner": "architecture-council",
      "version": "0.1.0",
      "status": "pilot",
      "review_frequency": "quarterly",
      "evaluation_suite": "architecture-evaluation",
      "may_spawn": [],
      "requires_human_approval_for": [
        "technology selection",
        "breaking API change",
        "architecture-changing decision"
      ],
      "notes": ""
    },
    {
      "name": "architecture-reviewer",
      "department": "architecture",
      "purpose": "Independently reviews architecture and ADRs for fitness, risk, consistency and non-functional coverage. Cannot author the architecture it reviews.",
      "tool_profile": "analysis-readonly",
      "default_model": "opus",
      "escalation_model": "opus",
      "risk": "HIGH",
      "owner": "architecture-council",
      "version": "0.1.0",
      "status": "pilot",
      "review_frequency": "quarterly",
      "evaluation_suite": "architecture-evaluation",
      "may_spawn": [],
      "requires_human_approval_for": [],
      "notes": "Separation of duty: must not be the same agent instance that produced the artifact under review."
    },
    {
      "name": "ux-designer",
      "department": "ux",
      "purpose": "Produces personas, journeys, wireframe specifications, design-system usage and the frontend contract for user-facing work.",
      "tool_profile": "author",
      "default_model": "sonnet",
      "escalation_model": "sonnet",
      "risk": "LOW",
      "owner": "design-chapter",
      "version": "0.1.0",
      "status": "pilot",
      "review_frequency": "quarterly",
      "evaluation_suite": "ux-evaluation",
      "may_spawn": [],
      "requires_human_approval_for": [],
      "notes": ""
    },
    {
      "name": "development-lead",
      "department": "engineering",
      "purpose": "Decomposes approved architecture into epics, stories and tasks, assigns implementation work and owns the definition of done.",
      "tool_profile": "lead",
      "default_model": "sonnet",
      "escalation_model": "opus",
      "risk": "MEDIUM",
      "owner": "engineering-chapter",
      "version": "0.2.0",
      "status": "pilot",
      "review_frequency": "quarterly",
      "evaluation_suite": "engineering-evaluation",
      "may_spawn": [
        "backend-developer",
        "frontend-developer",
        "data-engineer",
        "qa-engineer",
        "code-reviewer",
        "test-reviewer",
        "docs-writer"
      ],
      "requires_human_approval_for": [],
      "notes": ""
    },
    {
      "name": "backend-developer",
      "department": "engineering",
      "purpose": "Implements server-side and integration code plus its tests against an approved story, architecture and technology configuration.",
      "tool_profile": "implementer",
      "default_model": "sonnet",
      "escalation_model": "opus",
      "risk": "MEDIUM",
      "owner": "engineering-chapter",
      "version": "0.1.0",
      "status": "pilot",
      "review_frequency": "quarterly",
      "evaluation_suite": "development-evaluation",
      "may_spawn": [],
      "requires_human_approval_for": [
        "destructive database migration",
        "breaking API change",
        "dependency addition outside the approved stack"
      ],
      "notes": "Seniority is expressed by task complexity and model/effort escalation, not by a separate agent definition. See docs/agent-model.md."
    },
    {
      "name": "frontend-developer",
      "department": "engineering",
      "purpose": "Implements client-side code, state, accessibility and its tests against an approved story, UX contract and technology configuration.",
      "tool_profile": "implementer",
      "default_model": "sonnet",
      "escalation_model": "opus",
      "risk": "MEDIUM",
      "owner": "engineering-chapter",
      "version": "0.1.0",
      "status": "pilot",
      "review_frequency": "quarterly",
      "evaluation_suite": "development-evaluation",
      "may_spawn": [],
      "requires_human_approval_for": [
        "dependency addition outside the approved stack"
      ],
      "notes": ""
    },
    {
      "name": "data-engineer",
      "department": "data",
      "purpose": "Owns schema evolution, migrations, data pipelines and data-quality controls within the approved data platform.",
      "tool_profile": "implementer",
      "default_model": "sonnet",
      "escalation_model": "opus",
      "risk": "HIGH",
      "owner": "data-chapter",
      "version": "0.1.0",
      "status": "pilot",
      "review_frequency": "quarterly",
      "evaluation_suite": "data-evaluation",
      "may_spawn": [],
      "requires_human_approval_for": [
        "destructive or irreversible migration",
        "change to data retention or PII handling"
      ],
      "notes": ""
    },
    {
      "name": "docs-writer",
      "department": "knowledge",
      "purpose": "Maintains the project knowledge base, artifact links and release/reference documentation.",
      "tool_profile": "author",
      "default_model": "haiku",
      "escalation_model": "sonnet",
      "risk": "LOW",
      "owner": "knowledge-chapter",
      "version": "0.1.0",
      "status": "pilot",
      "review_frequency": "quarterly",
      "evaluation_suite": "documentation-evaluation",
      "may_spawn": [],
      "requires_human_approval_for": [],
      "notes": ""
    },
    {
      "name": "qa-lead",
      "department": "qa",
      "purpose": "Owns test strategy, scenario coverage and the risk-to-test mapping. Participates from story definition, not after implementation.",
      "tool_profile": "delegating-author",
      "default_model": "sonnet",
      "escalation_model": "opus",
      "risk": "MEDIUM",
      "owner": "qa-chapter",
      "version": "0.1.0",
      "status": "pilot",
      "review_frequency": "quarterly",